{
  "id": "contextpilot",
  "name": "ContextPilot",
  "summary": "Maintain local, resumable project checkpoints that reflect current evidence and decisions.",
  "purpose": "Create and inspect concise project checkpoints containing the objective, progress, architectural decisions, completed work, failures, and next steps.",
  "inputs": [
    {
      "name": "project_state",
      "required": true,
      "description": "Current objective, repository evidence, decisions, and progress."
    },
    {
      "name": "checkpoint_action",
      "required": true,
      "description": "Save, list, inspect, or restore a checkpoint."
    }
  ],
  "outputs": [
    {
      "name": "checkpoint_result",
      "description": "A validated local checkpoint or a clear checkpoint inspection and restore summary."
    }
  ],
  "procedure": [
    "Gather the current objective and confirm progress against repository state and the latest user instructions.",
    "For a save, record a concise summary, completed tasks, important decisions, failed checks, unresolved issues, and next steps.",
    "For a list request, show available checkpoint identifiers and safe summary metadata without exposing stored secrets or full source contents.",
    "For an inspect request, validate the selected checkpoint and show its objective, progress, decisions, failures, and next steps.",
    "Validate the checkpoint against its versioned schema before saving or restoring it.",
    "Keep checkpoint data local by default and store only the minimum context needed to resume.",
    "Exclude credentials, secret values, and large source files; refer to paths instead of copying contents.",
    "When restoring, compare the checkpoint with current repository state and label stale information before relying on it.",
    "Report the checkpoint action and any validation or restoration issues."
  ],
  "safety": [
    "Do not silently store credentials, secrets, or large source files.",
    "Treat current user instructions and repository state as more authoritative than old checkpoint content.",
    "Do not claim persistence unless a host-provided local save operation succeeded.",
    "Do not overwrite a checkpoint on a conflicting path without the host’s required approval."
  ],
  "capabilities": {
    "requiresModel": true,
    "requiresShell": false,
    "requiresNetwork": false
  },
  "examples": [
    {
      "input": "Save a checkpoint after the parser tests fail on an invalid version field.",
      "output": "Record the parser objective, completed schema work, exact failing test, relevant decision, current files, and next debugging step; exclude environment secrets and label the test failure as unresolved."
    }
  ],
  "acceptance": [
    "A saved checkpoint includes the current objective, progress, decisions, failures, and next steps.",
    "Checkpoint data is version-validated and contains no credentials or copied source bundles.",
    "Restore results distinguish current repository evidence from stale checkpoint claims."
  ],
  "version": "1.0.0",
  "compatibility": {
    "formatVersion": 1,
    "providers": ["any"]
  }
}
