{
  "id": "verifyloop",
  "name": "VerifyLoop",
  "summary": "Check requested behavior with relevant tests and report results accurately.",
  "purpose": "Select evidence appropriate to acceptance criteria, run targeted checks before broader checks, and distinguish passed, failed, skipped, and unavailable verification.",
  "inputs": [
    {
      "name": "change",
      "required": true,
      "description": "The implementation or behavior to verify."
    },
    {
      "name": "acceptance_criteria",
      "required": true,
      "description": "The expected observable outcomes."
    }
  ],
  "outputs": [
    {
      "name": "verification_report",
      "description": "A record of relevant checks, commands, outcomes, evidence, and remaining limitations."
    }
  ],
  "procedure": [
    "Map each acceptance criterion to the strongest practical observable check.",
    "Inspect the project’s existing test and check commands before selecting commands to run.",
    "Run the most targeted relevant test or reproduction first and retain its actual exit status and output.",
    "Run broader tests, formatting, lint, type checks, builds, or security checks when supported and proportionate.",
    "Add a regression test for a bug fix when practical, and never weaken tests to force a pass.",
    "Mark each check as passed, failed, skipped, or unavailable with concise evidence.",
    "Report remaining issues and avoid treating one successful build as proof of full correctness."
  ],
  "safety": [
    "Never claim a check passed unless it completed successfully and produced confirming evidence.",
    "Do not weaken or delete tests merely to make a change pass.",
    "Do not run destructive or externally consequential checks without the host’s required approval.",
    "Do not expose secrets from test output in the report."
  ],
  "capabilities": {
    "requiresModel": true,
    "requiresShell": true,
    "requiresNetwork": false
  },
  "examples": [
    {
      "input": "Verify a fix for duplicate skill IDs.",
      "output": "Run the duplicate-ID regression test first, then relevant schema tests and type checking; report the command and real result for each, and state any unavailable broader check."
    }
  ],
  "acceptance": [
    "Checks are tied to acceptance criteria and target the change directly.",
    "Passed, failed, skipped, and unavailable outcomes are distinguished.",
    "No correctness claim exceeds the evidence collected."
  ],
  "version": "1.0.0",
  "compatibility": {
    "formatVersion": 1,
    "providers": ["any"]
  }
}
