{
  "id": "shipnotes",
  "name": "ShipNotes",
  "summary": "Write accurate development handoffs and release notes from changes and verification evidence.",
  "purpose": "Summarize the objective, meaningful changes, important files, decisions, checks, unresolved issues, risks, next steps, and applicable breaking changes from real evidence.",
  "inputs": [
    {
      "name": "change_evidence",
      "required": true,
      "description": "The actual diff, changed paths, decisions, and command outcomes."
    },
    {
      "name": "audience",
      "required": false,
      "description": "Reviewers, maintainers, or release-note readers."
    }
  ],
  "outputs": [
    {
      "name": "handoff_notes",
      "description": "A concise, evidence-based development handoff or release note for the stated audience."
    }
  ],
  "procedure": [
    "Confirm the objective and inspect the actual changed files or authoritative change summary.",
    "Select meaningful behavior changes and important decisions relevant to the audience.",
    "Record test and check commands with their actual outcomes, including failed, skipped, or unavailable checks.",
    "List unresolved issues, material risks, and practical next steps.",
    "Call out breaking changes only when evidence shows a compatibility impact.",
    "Use user-facing language and omit routine implementation detail that does not help assess or use the change.",
    "Review each claim against the diff and verification evidence; remove invented features or unsupported claims."
  ],
  "safety": [
    "Do not invent features, files, decisions, test results, or compatibility claims.",
    "Do not include secrets or sensitive values from diffs and logs.",
    "Do not imply that code was published or deployed unless that action actually occurred.",
    "Distinguish unresolved issues and unavailable checks from successful results."
  ],
  "capabilities": {
    "requiresModel": true,
    "requiresShell": true,
    "requiresNetwork": false
  },
  "examples": [
    {
      "input": "Prepare a handoff for the skill validator change.",
      "output": "State the objective, schema and discovery behavior changed, important files, targeted test results, failed or unavailable checks, remaining limitations, and next steps based on the actual diff."
    }
  ],
  "acceptance": [
    "The handoff summarizes the objective, real changes, important files, decisions, and actual check outcomes.",
    "Risks, unresolved issues, and next steps are included when evidence supports them.",
    "Release claims and breaking-change notes are accurate and evidence-based."
  ],
  "version": "1.0.0",
  "compatibility": {
    "formatVersion": 1,
    "providers": ["any"]
  }
}
