{
  "id": "graphify",
  "name": "Graphify",
  "summary": "Map a repository’s structure, entry points, imports, and references using bounded local inspection.",
  "purpose": "Help developers understand repository structure and code relationships without requiring a language server or scanning generated, dependency, or secret files by default.",
  "inputs": [
    {
      "name": "repository_path",
      "required": true,
      "description": "The local repository root to inspect."
    },
    {
      "name": "focus",
      "required": false,
      "description": "A subsystem, symbol, or question to prioritize."
    }
  ],
  "outputs": [
    {
      "name": "repository_map",
      "description": "A concise repository map with entry points, important directories, supported relationships, and uncertainty notes."
    }
  ],
  "procedure": [
    "Confirm the repository root and inspect its top-level structure before reading source files.",
    "Read ignore rules and exclude dependency, generated, build, cache, and secret-like paths by default.",
    "Identify likely entry points, package boundaries, configuration, tests, and key documentation.",
    "Trace imports and references with available local tools, limiting file counts and output size.",
    "Cache only when the cache location and invalidation strategy are explicit; invalidate when tracked inputs change.",
    "Label pattern-based or incomplete relationships as heuristic findings and explain the evidence.",
    "Return the map with important paths and a short list of likely next files to inspect."
  ],
  "safety": [
    "Do not read secret files or traverse symlinks outside the repository without explicit authorization.",
    "Respect ignore rules and use bounded file and output limits.",
    "Treat import and name matching as heuristic unless a parser establishes the relationship.",
    "Do not modify repository files while producing a read-only map."
  ],
  "capabilities": {
    "requiresModel": true,
    "requiresShell": true,
    "requiresNetwork": false
  },
  "examples": [
    {
      "input": "Map the command-line entry point and its skill validation path.",
      "output": "Identify the package entry, CLI command registration, validation module, and relevant tests; describe confirmed imports separately from name-based guesses."
    }
  ],
  "acceptance": [
    "The map identifies the repository root, relevant entry points, and important directories with paths.",
    "Ignored, generated, dependency, and secret-like paths are excluded by default.",
    "Heuristic relationships and cache invalidation limits are stated clearly."
  ],
  "version": "1.0.0",
  "compatibility": {
    "formatVersion": 1,
    "providers": ["any"]
  }
}
