{
  "id": "tokensaver",
  "name": "TokenSaver",
  "summary": "Compress project context while preserving decisions, constraints, and evidence needed to continue work.",
  "purpose": "Remove repetition and stale details from long context while retaining important paths, identifiers, errors, decisions, current instructions, safety rules, and acceptance criteria.",
  "inputs": [
    {
      "name": "context",
      "required": true,
      "description": "Conversation, project notes, or prompt to condense."
    },
    {
      "name": "target",
      "required": false,
      "description": "Desired length or the next task that will use the summary."
    }
  ],
  "outputs": [
    {
      "name": "compact_context",
      "description": "A concise, resumable context summary with original and optimized character counts, comparable token counts or estimates when available, preserved constraints, intentionally removed information, and the measurement method."
    }
  ],
  "procedure": [
    "Identify the current objective and the next action that the summary must support.",
    "Extract concrete paths, identifiers, error messages, decisions, constraints, acceptance criteria, and unresolved issues.",
    "Remove duplicated explanations, stale assumptions superseded by newer evidence, and details irrelevant to the next action.",
    "Keep safety boundaries and required acceptance criteria intact even when they consume space.",
    "If character or token measurement is available, measure both inputs and outputs with the same method.",
    "Label token counts as estimates when using a heuristic or when the exact tokenizer is unavailable.",
    "Compute a reduction percentage only when original and optimized measurements use comparable units and methods.",
    "Return original and optimized character counts, token counts or estimates when available, preserved constraints, intentionally removed information, and the measurement method."
  ],
  "safety": [
    "Never claim exact token counts without the exact tokenizer and measurement method.",
    "Never invent token-savings percentages or remove safety and acceptance requirements for brevity.",
    "Treat current user instructions and repository evidence as more authoritative than stale summaries."
  ],
  "capabilities": {
    "requiresModel": true,
    "requiresShell": false,
    "requiresNetwork": false
  },
  "examples": [
    {
      "input": "A long thread repeats that src/api.ts is out of scope and records a failing timeout test.",
      "output": "Keep the objective, the out-of-scope path, the exact timeout failure, the decision already made, and the next test to run; remove repeated background. If tokens are estimated, label the estimate and tokenizer limitation."
    }
  ],
  "acceptance": [
    "The next person can resume the stated objective without reopening removed context.",
    "Important paths, identifiers, failures, decisions, constraints, and safety rules remain accurate.",
    "The report includes character counts, comparable token counts or labeled estimates, preserved constraints, removed information, and measurement method when measurements are available.",
    "Any approximate measurement is clearly labeled and no percentage is fabricated."
  ],
  "version": "1.0.0",
  "compatibility": {
    "formatVersion": 1,
    "providers": ["any"]
  }
}
